{
  "$schema": "https://json-schema.org/draft/2020-12/schema",
  "title": "ExecForge Q Level State",
  "type": "object",
  "required": [
    "version",
    "initiative",
    "run_id",
    "created_at",
    "updated_at",
    "branch",
    "commit",
    "artifact_root",
    "next_action",
    "state"
  ],
  "properties": {
    "version": {
      "type": "string"
    },
    "initiative": {
      "type": "string"
    },
    "run_id": {
      "type": "string"
    },
    "created_at": {
      "type": "string"
    },
    "updated_at": {
      "type": "string"
    },
    "branch": {
      "type": [
        "string",
        "null"
      ]
    },
    "commit": {
      "type": [
        "string",
        "null"
      ]
    },
    "artifact_root": {
      "type": "string"
    },
    "next_action": {
      "type": "string"
    },
    "state": {
      "enum": [
        "NO_QA_CONTEXT",
        "QA_INPUT_REQUIRED",
        "QA_PLAN_REQUIRED",
        "QA_PLAN_APPROVAL_REQUIRED",
        "QA_READY",
        "QA_IN_PROGRESS",
        "QA_RETEST_REQUIRED",
        "QA_PASSED",
        "QA_RELEASE_READY",
        "RETURN_TO_IMPLEMENTATION",
        "RETURN_TO_ENGINEERING_PLAN",
        "RETURN_TO_PRODUCT",
        "BLOCKED",
        "UNVERIFIABLE"
      ]
    },
    "plan_status": {
      "enum": [
        "NOT_CREATED",
        "DRAFT",
        "APPROVED",
        "REJECTED"
      ]
    },
    "plan_version": {
      "type": [
        "string",
        "null"
      ]
    },
    "plan_approval_status": {
      "enum": [
        "PENDING",
        "APPROVED",
        "REJECTED",
        "CHANGES_REQUESTED"
      ]
    },
    "plan_approved_by": {
      "type": [
        "string",
        "null"
      ]
    },
    "plan_approved_at": {
      "type": [
        "string",
        "null"
      ]
    },
    "target_environment": {
      "type": [
        "string",
        "null"
      ]
    },
    "environment_approval_status": {
      "enum": [
        "PENDING",
        "APPROVED",
        "REJECTED",
        "CHANGES_REQUESTED"
      ]
    },
    "approved_destructive_techniques": {
      "type": "array",
      "items": {
        "type": "string"
      }
    },
    "build_or_commit": {
      "type": [
        "string",
        "null"
      ]
    },
    "execution_status": {
      "enum": [
        "NOT_STARTED",
        "IN_PROGRESS",
        "RETEST_REQUIRED",
        "COMPLETE"
      ]
    },
    "evidence_status": {
      "enum": [
        "MISSING",
        "PARTIAL",
        "COMPLETE"
      ]
    },
    "coverage_complete": {
      "type": "boolean"
    },
    "data_qa_required": {
      "type": "boolean"
    },
    "final_verdict": {
      "type": [
        "string",
        "null"
      ],
      "enum": [
        null,
        "QA PASS",
        "QA PASS WITH ACCEPTED RISKS",
        "RETURN TO IMPLEMENTATION",
        "RETURN TO ENGINEERING PLAN",
        "RETURN TO PRODUCT",
        "BLOCK RELEASE",
        "UNVERIFIABLE"
      ]
    },
    "open_q0": {
      "type": "array",
      "items": {
        "type": "string"
      }
    },
    "open_q1": {
      "type": "array",
      "items": {
        "type": "string"
      }
    },
    "open_q2": {
      "type": "array",
      "items": {
        "type": "string"
      }
    },
    "open_q3": {
      "type": "array",
      "items": {
        "type": "string"
      }
    },
    "accepted_risks": {
      "type": "array",
      "items": {
        "type": "string"
      }
    },
    "untested_areas": {
      "type": "array",
      "items": {
        "type": "string"
      }
    }
  },
  "additionalProperties": true
}
