{
  "version": "2",
  "initiative": "cross-repo-rollup",
  "run_id": "20260717T033357818644Z-0c9b96b7-cross-repo-rollup",
  "created_at": "2026-07-17T03:33:57.818644+00:00",
  "updated_at": "2026-07-17T03:33:57.818644+00:00",
  "branch": "ci/windows-runtime-verification",
  "commit": "a266460cc822449a22e3d3486d926fc3cd6820ea",
  "artifact_root": ".q-level/runs/20260717T033357818644Z-0c9b96b7-cross-repo-rollup",
  "next_action": "Complete QA context after engineering handoff.",
  "state": "QA_INPUT_REQUIRED",
  "plan_status": "NOT_CREATED",
  "plan_version": null,
  "plan_approval_status": "PENDING",
  "plan_approved_by": null,
  "plan_approved_at": null,
  "target_environment": null,
  "environment_approval_status": "PENDING",
  "approved_destructive_techniques": [],
  "build_or_commit": null,
  "execution_status": "NOT_STARTED",
  "evidence_status": "MISSING",
  "coverage_complete": false,
  "data_qa_required": false,
  "final_verdict": null,
  "open_q0": [],
  "open_q1": [],
  "open_q2": [],
  "open_q3": [],
  "accepted_risks": [],
  "untested_areas": []
}
